[
	{
		"id": 1,
		"date": "10/02/2025",
		"time": "6-8 PM",
		"title": "Switching Lab",
		"location": "THOM 105",
		"description": "Get hands-on with Cisco switches in our 1st lab of the semester! RSVP required to attend."
	},
	{
		"id": 2,
		"date": "10/30/2025",
		"time": "6-8 PM",
		"title": "Routing Lab",
		"location": "THOM 105",
		"description": "Get hands-on with Cisco routers in our 2nd lab of the semester! RSVP required to attend."
	},
	{
		"id": 3,
		"date": "11/20/2025",
		"time": "6-8 PM",
		"title": "Wireless Lab",
		"location": "THOM 105",
		"description": "Get hands-on with Cisco WLCs and APs in our 3rd and final lab of the semester! RSVP required to attend."
	},
	{
		"id": 4,
		"date": "8/24/2026 - 8/26/2026",
		"time": "8:30 AM - 3:30 PM",
		"title": "Bannering",
		"location": "Zach Engineering Quad Entrance",
		"description": "Come cool off with some tasty popsicles and learn more about the club in front Zach! Look for the black poster and heaps of locks to pick."
	},
	{
		"id": 5,
		"date": "9/1/2026",
		"time": "10:00 AM - 12:50 PM",
		"title": "ESO Open House",
		"location": "ZACH ConocoPhillips Atrium",
		"description": "Learn more about the what we do at the Cybersecurity Club along with the other Engineering organizations on campus."
	},
	{
		"id": 6,
		"date": "9/6/2026",
		"time": "1:00-5:00 PM",
		"title": "Club Crawl",
		"location": "MSC",
		"description": "Meet us in person at the Club Crawl to learn about the club and for some fun banter!"
	},
	{
		"id": 7,
		"date": "9/8/2026",
		"time": "7:30-9:30 PM",
		"title": "Tuesday Informational",
		"location": "BLOC 102",
		"description": "Learn about how the Texas A&M Cybersecurity Club works and talk directly to officers about the opportunities available!"
	},
	{
		"id": 8,
		"date": "9/9/2026",
		"time": "7:30-9:30 PM",
		"title": "Wednesday Informational",
		"location": "BLOC 102",
		"description": "Learn about how the Texas A&M Cybersecurity Club works and talk directly to officers about the opportunities available!"
	}
]
